User,Content,Date,Favs,RTs
RepStephMurphy,"One year ago today, the President signed our #Pulse National Memorial bill into law. Orlando still aches for the 49… https://t.co/yN90IY4k6s",2022-06-25 16:01:16+00:00,27,3
RepJerryNadler,"Incredible showing of mass solidarity in NY tonight against this mornings disgraceful SCOTUS ruling. 

It is crucia… https://t.co/SjXXbRchQa",2022-06-25 02:08:10+00:00,328,67
gracenapolitano,The Bipartisan #SaferCommunities Act does the most critical thing any gun violence prevention bill can do: saves li… https://t.co/UVQ9zE74ab,2022-06-24 18:29:33+00:00,1,1
RepRichardNeal,Today’s ruling is the dangerous culmination of Republicans’ decades-long effort to roll back women’s freedoms and c… https://t.co/ukOUvzSKe7,2022-06-24 14:48:52+00:00,30,12
RepJoeNeguse,"Today’s decision by the Supreme Court to overrule Roe v. Wade is a devastating one. 

The Congress must step up, an… https://t.co/mNvaVuZNdF",2022-06-24 15:03:57+00:00,295,46
RepMarieNewman,✅ Co-sponsored the Stop Anti-Abortion Disinformation Act to crack down on false information on abortion provided by… https://t.co/OzjtOUM4yo,2022-06-25 18:34:38+00:00,5,2
DonaldNorcross,"For 7 years, our country has ensured marriage equality for millions of LGBTQ+ Americans. 

I have no patience for t… https://t.co/ABh5uu1bFD",2022-06-26 13:04:00+00:00,2,1
EleanorNorton,"I’m outraged by today's SCOTUS decision overturning Roe, which poses a unique threat to women in DC.

Without… https://t.co/PPOn2rYIiX",2022-06-24 16:04:35+00:00,129,46
RepOHalleran,"Two years ago, the Blue Water Navy Vietnam Veterans Act was signed into law, extending benefits to veterans exposed… https://t.co/YwpAooJMrs",2022-06-25 22:15:00+00:00,5,2
RepAOC,"""To all of those who are watching today's events unfold in fear, in anger, in rage, in depression, and in anxiety,… https://t.co/wA4k1ol52g",2022-06-24 21:02:29+00:00,3146,649
Ilhan,"You can read the full statement here:
https://t.co/mq1jKbGGOx",2022-06-24 14:23:00+00:00,162,26
FrankPallone,"FDA was right to pull JUUL from the market. 

This is a disturbing decision that will allow these dangerous product… https://t.co/7i7x1CLIqi",2022-06-26 01:41:50+00:00,4,2
RepJimmyPanetta,The bipartisan Save Our Sequoias Act allows the federal government the chance to play its part with necessary fundi… https://t.co/zbfxXZ092O,2022-06-26 02:24:31+00:00,13,4
RepChrisPappas,Today we took historic action to prevent senseless gun violence and save lives. This bill expands background checks… https://t.co/6QEIRcId4F,2022-06-24 18:00:42+00:00,6,3
BillPascrell,RT @BillPascrell: This republican member of Congress tonight spewing racism beside donald trump praised hitler her first week in office. Th…,2022-06-26 14:05:24+00:00,0,405
RepDonaldPayne,"I supported the Senate's gun control bill because it keeps guns out of the hands of criminals, increases school pro… https://t.co/5Sos1AqRDY",2022-06-24 18:00:11+00:00,6,3
SpeakerPelosi,"Over the last few days, the Supreme Court inflicted devastation on our nation. We must and will keep up the fight f… https://t.co/wdXGXBKdIK",2022-06-26 02:41:05+00:00,1361,244
RepPerlmutter,"3/ will be left with uneven, unjust &amp; dangerous options for their reproductive healthcare needs. For too many women… https://t.co/of1dDzhfcJ",2022-06-24 17:12:32+00:00,7,1
RepScottPeters,"The bipartisan work to keep our communities safe prevailed today. We still have a long road ahead, but we celebrate… https://t.co/KWOVBadnQA",2022-06-24 19:57:48+00:00,4,2
RepDeanPhillips,Because the Secretary of State is probably fielding calls from leaders around the world asking how a nation known f… https://t.co/rXe2fxdb3s,2022-06-26 00:56:21+00:00,489,61
chelliepingree,"After today’s Supreme Court decision, having a strong pro-choice governor is more critical than ever. Maine is fort… https://t.co/vvCjdoCI9e",2022-06-25 00:05:22+00:00,83,15
StaceyPlaskett,"Yes Jeffrey Clark is a pettifogger.., lickspittle and quack also come to mind 

Oh, and criminal https://t.co/GXBkNthXhQ",2022-06-24 18:33:39+00:00,131,24
RepMarkPocan,"RT @taureansmall: “This is an extreme position by this court” 
@RepMarkPocan reacts to the #SCOTUS decision to overturn Roe v Wade.

He oth…",2022-06-24 18:42:54+00:00,0,11
RepKatiePorter,"We can talk tomorrow about how this partisan ruling substitutes a political agenda for decades of precedent. 

Toda… https://t.co/MHIY05Annj",2022-06-24 14:49:27+00:00,2956,409
RepPressley,"We're not backing down in the fight for reproductive freedom. We must:

—Declare a public health emergency
—End the… https://t.co/GhXnL6zDEb",2022-06-26 14:00:00+00:00,257,63
RepDavidEPrice,Congressman Price's Statement on the Death of Lisa Price. https://t.co/2BN5jPyIjA,2022-06-23 17:49:21+00:00,1523,106
RepMikeQuigley,I stand with my district when I say that I am disgusted by this week's SCOTUS decision. I will fight relentlessly f… https://t.co/IZ0OfhWVR8,2022-06-25 21:16:00+00:00,71,15
RepRaskin,"Meantime, 16 states, including MD, are still free choice states for women. Next week I am introducing a Resolution… https://t.co/NpCD4JX43s",2022-06-25 02:45:01+00:00,28387,5390
RepKathleenRice,"Spare me about the sanctity of life. Between yesterday's decision on guns and today's on choice, this Supreme Court… https://t.co/E7Uoue1kG6",2022-06-24 14:52:30+00:00,93,28
RepDeborahRoss,Yesterday was a dark day in our history – a day when millions of women lost their freedom and autonomy over their o… https://t.co/ITY4iaml05,2022-06-25 14:04:14+00:00,10,2
RepRoybalAllard,"2/2

Nuestra ley estatal protege el derecho a las decisiones reproductivas personales.",2022-06-24 18:11:27+00:00,1,0
RepRaulRuizMD,"Today, we celebrate 4 years since the Blue Water Navy Veterans Act was signed into law, ensuring deserved benefits… https://t.co/ieZrMKC1K4",2022-06-25 17:00:00+00:00,18,5
Call_Me_Dutch,"Today I + my fellow Appropriators advanced the FY23 Homeland Security funding bill, which includes $2M I fought for… https://t.co/Km8j1QC4Xs",2022-06-24 21:02:39+00:00,1,1
RepBobbyRush,"RT @RepKClark: We just sent the first gun reform bill to the President’s desk in 30 years. 

I know today may feel hopeless - heartbreaking…",2022-06-24 18:16:54+00:00,0,11
RepTimRyan,We passed the Women’s Health Protection Act in the House when Roe was hanging in the balance. We knew this was comi… https://t.co/I7BtZ3R3OX,2022-06-25 14:30:00+00:00,319,104
Kilili_Sablan,"The Marianas' '22 Congressional Art Competition winner Gericho Conge is now on display at the US Capitol, along wit… https://t.co/bjcbsDGGTj",2022-06-24 02:00:00+00:00,0,0
GuamCongressman,"Guam Frontline HEROES ACT, save family of 12.

https://t.co/BTcYiRxmen",2020-05-17 15:15:17+00:00,84,13
RepLindaSanchez,"I am heartened by the progress made today, &amp; I will keep fighting alongside my colleagues in Congress to enact more… https://t.co/MbolOwXMpp",2022-06-24 17:41:22+00:00,1,0
RepSarbanes,I was proud to vote in support of the Women’s Health Protection Act when it passed the House last year. I will cont… https://t.co/SQVX3ts5yY,2022-06-24 18:45:19+00:00,13,2
RepMGS,"RT @RepSpeier: Roe may be dead but medication abortion used by 54% of women who have abortions is FDA approved, safe and effective. No clin…",2022-06-25 19:44:07+00:00,0,14672
janschakowsky,"After nearly 30 years of tireless advocacy, the House and Senate have finally passed a gun safety bill and @POTUS h… https://t.co/PxrpsZ9ybb",2022-06-25 18:29:46+00:00,18,3
RepAdamSchiff,Abolish the filibuster. Codify Roe.,2022-06-24 22:00:00+00:00,185909,31926
RepSchneider,"Thank you Deerfield for coming out today and leading a great conversation on health care, fiscal responsibility, an… https://t.co/AuDBmjUPfz",2022-06-25 19:01:24+00:00,3,1
RepSchrader,My statement on the Supreme Court’s decision to overturn Roe v. Wade: https://t.co/INk1vnWHSo,2022-06-24 17:20:00+00:00,18,5
RepKimSchrier,"In DC, I stopped by the Supreme Court after the decision overturning Roe v. Wade was announced. As the only pro-cho… https://t.co/BzDXJ9Crse",2022-06-25 19:13:00+00:00,64,9
repdavidscott,"As a husband, a father, and a grandfather, I hope and pray for a future where women’s access to education, employme… https://t.co/RjXDjsJ6U4",2022-06-24 16:24:20+00:00,13,4
BobbyScott,Great seeing Newport News Shipbuilding President Jennifer Boykin at the USS Montana Christening today! https://t.co/Waf04ZFg71,2022-06-26 01:40:48+00:00,10,3
RepTerriSewell,We in Congress cannot continue to sit by as our democracy comes under attack. I am once again calling on our Senato… https://t.co/705amacHwb,2022-06-25 18:26:48+00:00,26,3
BradSherman,It was great to speak at the 7th Annual Valley #Pride hosted by @CD6Nury — a wonderful and vibrant event where the… https://t.co/Y7uPPgejbR,2022-06-26 06:25:49+00:00,19,3
RepSherrill,My team is at Morris County Pride today! Proud to join the many organizations participating to support and be a res… https://t.co/Nsddqf9WZU,2022-06-25 20:02:33+00:00,50,4
RepSires,"This case fundamentally changes our nation in a way I never thought I would see, leaving millions of women without… https://t.co/gumCdEZoz4",2022-06-24 17:34:28+00:00,2,0
RepSlotkin,"As I cast my ‘yes’ vote today, I was thinking about the students, parents, teachers and first responders in Oxford… https://t.co/rgT6TubVwx",2022-06-24 21:02:25+00:00,27,4
RepAdamSmith,"9 years ago today, in Shelby County v. Holder, the Supreme Court struck down a key provision of the Voting Rights A… https://t.co/RWZRkYWqj9",2022-06-25 17:00:00+00:00,8,5
RepDarrenSoto,RT @RepDarrenSoto: Proud to vote for legislation on the House floor yesterday to end price gouging and penalize market manipulators. It's t…,2022-06-26 14:10:38+00:00,0,13
RepSpanberger,"These commonsense measures are long overdue.

I am proud that my colleagues in the House and Senate from both sides… https://t.co/e83hFMgY0g",2022-06-24 19:20:19+00:00,23,7
RepSpeier,"Yesterday was a dark day, but there is a path forward. We must elect 2 more pro-choice Senators willing to blow up… https://t.co/bpx81ahDWr",2022-06-25 20:40:18+00:00,761,153
Rep_Stansbury,"RT @JamesPoliti: “Frightened, fired up, and activated” - ⁦@Rep_Stansbury⁩, New Mexico Democrat, told me how millions are feeling about the…",2022-06-26 08:33:24+00:00,0,8
RepGregStanton,RT @PhoenixMercury: https://t.co/K2OR3xJSJd,2022-06-25 22:13:11+00:00,0,24
RepHaleyStevens,"Nearly 70% of Americans support abortion access.

This decision is NOT the will of the people. It is part of an ext… https://t.co/cBP5yCL75i",2022-06-25 14:58:09+00:00,308,81
RepStricklandWA,"Read my statement below.

https://t.co/alSB1jtayn",2022-06-24 15:26:05+00:00,2,3
RepTomSuozzi,"Decade after decade, our country lived through mass shootings without Congress taking any meaningful action to addr… https://t.co/e5SNkiVm8u",2022-06-24 17:54:21+00:00,14,1
RepSwalwell,"Thank you to everyone who came out to stand up for women’s freedom today in Hayward.

It’s an honor to stand beside… https://t.co/XnHdkpCoYK",2022-06-25 20:29:12+00:00,4694,529
RepMarkTakano,WE WILL NOT GO BACK. https://t.co/UJX1ay5IJG,2022-06-25 19:40:05+00:00,32,9
BennieGThompson,Congressman Bennie Thompson statement on Supreme Court’s decision to overturn Roe. v Wade: https://t.co/3OqrM9vCyV,2022-06-24 21:10:43+00:00,310,84
RepThompson,Congratulations to Oscar De Haro on his 17+ years of service as Superintendent of Student Affairs at Napa Valley Co… https://t.co/xFlHbx5BYv,2022-06-26 01:40:02+00:00,7,1
repdinatitus,"Fewer Americans are dying of cancer because of progress in prevention, early detection, and treatment. This… https://t.co/lBHeKBmEFP",2022-06-26 14:00:00+00:00,1,1
RepRashida,Today’s SCOTUS decision may feel overwhelming and confusing. I will not stop fighting until we ensure that EVERYONE… https://t.co/nEAQkZEsLX,2022-06-24 21:04:14+00:00,199,20
RepPaulTonko,The will of the people of the United States cannot be held hostage to the whims of a handful of politicians in blac… https://t.co/qN0RovySlO,2022-06-25 15:44:27+00:00,9,3
NormaJTorres,This court has abandoned our core value of liberty and decided that women are second-class citizens. We will not st… https://t.co/ZCwnZ63RJ6,2022-06-24 19:56:18+00:00,64,16
RepRitchie,"The Supreme Court has held that women in 2022 should have less liberty, privacy, and equality - less control over t… https://t.co/4vXkdYTLhL",2022-06-24 16:57:52+00:00,24,6
RepLoriTrahan,Today marks 7 years since the Supreme Court's Obergefell decision legalized same-sex marriage. This anniversary is… https://t.co/TW0Cgm30sb,2022-06-26 13:21:40+00:00,46,17
RepDavidTrone,"This is the reality: overturning #RoeVWade will, without question, jeopardize the progress we've made in gender equ… https://t.co/OO1iSA5XFI",2022-06-24 19:39:36+00:00,14,3
RepUnderwood,A child from my community wrote to me saying that they plan their exit routes whenever they're at school — in case… https://t.co/ArOAKOciSo,2022-06-26 01:00:00+00:00,315,58
RepJuanVargas,"RT @POTUS: Tune in as I sign into law S. 2938, the Bipartisan Safer Communities Act, and deliver remarks on reducing gun violence and savin…",2022-06-25 14:45:29+00:00,0,1721
RepFilemonVela,"Today would have been #CésarChávez's 95th birthday.

On #CésarChávezDay, I'm proud to co-sponsor a resolution that… https://t.co/UzFQp1k5HH",2022-03-31 20:29:49+00:00,11,5
NydiaVelazquez,"RT @ABC: Following Friday's Supreme Court decision, House Democrats marched from the Capitol to the Supreme Court to protest abortion acces…",2022-06-25 13:38:21+00:00,0,2086
RepMaxineWaters,"RT @RepMaxineWaters: As a Member of Congress, I'm proud to have voted to protect abortion access. Today's SCOTUS decision makes it even mor…",2022-06-24 21:48:58+00:00,0,167
RepBonnie,RT @RepBonnie: The maternal mortality rate for Black women in the United States exceeds most of the industrialized world. Almost 3 times as…,2022-06-25 02:36:11+00:00,0,47
PeterWelch,This decision is the most significant attack on women’s rights in a generation. It is a disgrace. My full statement… https://t.co/IyemIfwxdi,2022-06-24 15:33:01+00:00,41,12
RepWexton,RT @nicholaswu12: There’s a group of House Dems walking to the Supreme Court chanting: “we trust women. We won’t go back” https://t.co/R4IU…,2022-06-24 15:30:04+00:00,0,27
RepSusanWild,"The Bipartisan #SaferCommunities Act is a step in the right direction to help reduce gun violence.

I’m going to ke… https://t.co/H13Qy68aW3",2022-06-24 18:28:50+00:00,6,1
RepNikema,"RT @Porter_Anderson: Media: @RepNikema (GA05) to @Acosta: The #RoeVWade ruling ""is a state of emergency for Black women who already, in hea…",2022-06-25 21:01:25+00:00,0,4
RepWilson,"This morning, I joined @FLOTUS, local and state leaders, along with survivors and families to mark the anniversary… https://t.co/DdJbHsI3ej",2022-06-24 22:35:17+00:00,13,2
RepJohnYarmuth,"This will save lives — period. But we can’t stop here, and we won’t stop here.",2022-06-24 21:18:24+00:00,19,2
